"No.","Time","Source","Destination","Protocol","Length","Bytes in flight","Window size value","Calculated window size","Info"
"2","0.000000","10.63.7.192","128.119.245.12","TCP","66","","8192","8192","2262  >  80 [SYN] Seq=0 Win=8192 Len=0 MSS=1460 WS=256 SACK_PERM=1"
"8","0.030248","128.119.245.12","10.63.7.192","TCP","66","","29200","29200","80  >  2262 [SYN, ACK] Seq=0 Ack=1 Win=29200 Len=0 MSS=1460 SACK_PERM=1 WS=128"
"9","0.000069","10.63.7.192","128.119.245.12","TCP","54","","256","65536","2262  >  80 [ACK] Seq=1 Ack=1 Win=65536 Len=0"
"106","0.016710","10.63.7.192","128.119.245.12","TCP","714","660","256","65536","2262  >  80 [PSH, ACK] Seq=1 Ack=1 Win=65536 Len=660 [TCP segment of a reassembled PDU]"
"107","0.000225","10.63.7.192","128.119.245.12","TCP","1514","2120","256","65536","2262  >  80 [ACK] Seq=661 Ack=1 Win=65536 Len=1460 [TCP segment of a reassembled PDU]"
"108","0.032491","128.119.245.12","10.63.7.192","TCP","60","","239","30592","80  >  2262 [ACK] Seq=1 Ack=661 Win=30592 Len=0"
"109","0.000000","128.119.245.12","10.63.7.192","TCP","60","","262","33536","80  >  2262 [ACK] Seq=1 Ack=2121 Win=33536 Len=0"
"110","0.000033","10.63.7.192","128.119.245.12","TCP","4434","4380","256","65536","2262  >  80 [ACK] Seq=2121 Ack=1 Win=65536 Len=4380 [TCP segment of a reassembled PDU]"
"146","0.031394","128.119.245.12","10.63.7.192","TCP","60","","330","42240","80  >  2262 [ACK] Seq=1 Ack=6501 Win=42240 Len=0"
"147","0.000053","10.63.7.192","128.119.245.12","TCP","8814","8760","256","65536","2262  >  80 [ACK] Seq=6501 Ack=1 Win=65536 Len=8760 [TCP segment of a reassembled PDU]"
"148","0.032416","128.119.245.12","10.63.7.192","TCP","60","","467","59776","80  >  2262 [ACK] Seq=1 Ack=15261 Win=59776 Len=0"
"149","0.000067","10.63.7.192","128.119.245.12","TCP","14654","14600","256","65536","2262  >  80 [PSH, ACK] Seq=15261 Ack=1 Win=65536 Len=14600 [TCP segment of a reassembled PDU]"
"150","0.033628","128.119.245.12","10.63.7.192","TCP","60","","604","77312","80  >  2262 [ACK] Seq=1 Ack=24021 Win=77312 Len=0"
"151","0.000002","128.119.245.12","10.63.7.192","TCP","60","","695","88960","80  >  2262 [ACK] Seq=1 Ack=29861 Win=88960 Len=0"
"152","0.000121","10.63.7.192","128.119.245.12","TCP","20006","19952","256","65536","2262  >  80 [PSH, ACK] Seq=29861 Ack=1 Win=65536 Len=19952 [TCP segment of a reassembled PDU]"
"154","0.000424","10.63.7.192","128.119.245.12","TCP","5894","25792","256","65536","2262  >  80 [ACK] Seq=49813 Ack=1 Win=65536 Len=5840 [TCP segment of a reassembled PDU]"
"186","0.035826","128.119.245.12","10.63.7.192","TCP","60","","809","103552","80  >  2262 [ACK] Seq=1 Ack=37161 Win=103552 Len=0"
"187","0.000002","128.119.245.12","10.63.7.192","TCP","60","","1007","128896","80  >  2262 [ACK] Seq=1 Ack=49813 Win=128896 Len=0"
"188","0.000001","128.119.245.12","10.63.7.192","TCP","60","","1030","131840","80  >  2262 [ACK] Seq=1 Ack=51273 Win=131840 Len=0"
"189","0.000001","128.119.245.12","10.63.7.192","TCP","60","","1098","140544","80  >  2262 [ACK] Seq=1 Ack=55653 Win=140544 Len=0"
"190","0.000085","10.63.7.192","128.119.245.12","TCP","10598","10544","256","65536","2262  >  80 [PSH, ACK] Seq=55653 Ack=1 Win=65536 Len=10544 [TCP segment of a reassembled PDU]"
"193","0.000557","10.63.7.192","128.119.245.12","TCP","16438","26928","256","65536","2262  >  80 [PSH, ACK] Seq=66197 Ack=1 Win=65536 Len=16384 [TCP segment of a reassembled PDU]"
"195","0.000291","10.63.7.192","128.119.245.12","TCP","16438","43312","256","65536","2262  >  80 [PSH, ACK] Seq=82581 Ack=1 Win=65536 Len=16384 [TCP segment of a reassembled PDU]"
"257","0.039222","128.119.245.12","10.63.7.192","TCP","60","","1263","161664","80  >  2262 [ACK] Seq=1 Ack=66197 Win=161664 Len=0"
"258","0.000003","128.119.245.12","10.63.7.192","TCP","60","","1326","169728","80  >  2262 [ACK] Seq=1 Ack=76417 Win=169728 Len=0"
"259","0.000001","128.119.245.12","10.63.7.192","TCP","60","","1286","164608","80  >  2262 [ACK] Seq=1 Ack=82581 Win=164608 Len=0"
"260","0.000001","128.119.245.12","10.63.7.192","TCP","60","","1403","179584","80  >  2262 [ACK] Seq=1 Ack=89881 Win=179584 Len=0"
"261","0.000001","128.119.245.12","10.63.7.192","TCP","60","","1403","179584","80  >  2262 [ACK] Seq=1 Ack=97181 Win=179584 Len=0"
"262","0.000001","128.119.245.12","10.63.7.192","TCP","60","","1390","177920","80  >  2262 [ACK] Seq=1 Ack=98965 Win=177920 Len=0"
"263","0.000656","10.63.7.192","128.119.245.12","TCP","16438","16384","256","65536","2262  >  80 [PSH, ACK] Seq=98965 Ack=1 Win=65536 Len=16384 [TCP segment of a reassembled PDU]"
"264","0.000253","10.63.7.192","128.119.245.12","TCP","16438","32768","256","65536","2262  >  80 [PSH, ACK] Seq=115349 Ack=1 Win=65536 Len=16384 [TCP segment of a reassembled PDU]"
"266","0.000260","10.63.7.192","128.119.245.12","TCP","16438","49152","256","65536","2262  >  80 [PSH, ACK] Seq=131733 Ack=1 Win=65536 Len=16384 [TCP segment of a reassembled PDU]"
"267","0.000200","10.63.7.192","128.119.245.12","TCP","16438","65536","256","65536","2262  >  80 [PSH, ACK] Seq=148117 Ack=1 Win=65536 Len=16384 [TCP segment of a reassembled PDU]"
"268","0.000251","10.63.7.192","128.119.245.12","TCP","8814","74296","256","65536","2262  >  80 [ACK] Seq=164501 Ack=1 Win=65536 Len=8760 [TCP segment of a reassembled PDU]"
"396","0.045634","128.119.245.12","10.63.7.192","TCP","60","","1403","179584","80  >  2262 [ACK] Seq=1 Ack=106265 Win=179584 Len=0"
"397","0.000002","128.119.245.12","10.63.7.192","TCP","60","","1349","172672","80  >  2262 [ACK] Seq=1 Ack=115349 Win=172672 Len=0"
"398","0.000001","128.119.245.12","10.63.7.192","TCP","60","","1326","169728","80  >  2262 [ACK] Seq=1 Ack=119729 Win=169728 Len=0"
"399","0.000000","128.119.245.12","10.63.7.192","TCP","60","","1537","196736","80  >  2262 [ACK] Seq=1 Ack=127029 Win=196736 Len=0"
"400","0.000003","128.119.245.12","10.63.7.192","TCP","60","","1610","206080","80  >  2262 [ACK] Seq=1 Ack=131733 Win=206080 Len=0"
"401","0.000001","128.119.245.12","10.63.7.192","TCP","60","","1633","209024","80  >  2262 [ACK] Seq=1 Ack=133193 Win=209024 Len=0"
"402","0.000001","128.119.245.12","10.63.7.192","TCP","60","","1747","223616","80  >  2262 [ACK] Seq=1 Ack=140493 Win=223616 Len=0"
"403","0.000000","128.119.245.12","10.63.7.192","TCP","60","","1861","238208","80  >  2262 [ACK] Seq=1 Ack=147793 Win=238208 Len=0"
"404","0.000001","128.119.245.12","10.63.7.192","TCP","60","","1884","241152","80  >  2262 [ACK] Seq=1 Ack=148117 Win=241152 Len=0"
"405","0.000001","128.119.245.12","10.63.7.192","TCP","60","","1975","252800","80  >  2262 [ACK] Seq=1 Ack=153957 Win=252800 Len=0"
"406","0.000000","128.119.245.12","10.63.7.192","TCP","60","","2089","267392","80  >  2262 [ACK] Seq=1 Ack=161257 Win=267392 Len=0"
"407","0.000158","10.63.7.192","128.119.245.12","TCP","64294","76244","256","65536","2262  >  80 [PSH, ACK] Seq=173261 Ack=1 Win=65536 Len=64240 [TCP segment of a reassembled PDU]"
"408","0.000053","10.63.7.192","128.119.245.12","TCP","8974","85164","256","65536","2262  >  80 [PSH, ACK] Seq=237501 Ack=1 Win=65536 Len=8920 [TCP segment of a reassembled PDU]"
"409","0.000093","128.119.245.12","10.63.7.192","TCP","60","","2140","273920","80  >  2262 [ACK] Seq=1 Ack=164501 Win=273920 Len=0"
"410","0.000001","128.119.245.12","10.63.7.192","TCP","60","","2186","279808","80  >  2262 [ACK] Seq=1 Ack=167421 Win=279808 Len=0"
"411","0.000001","128.119.245.12","10.63.7.192","TCP","60","","2277","291456","80  >  2262 [ACK] Seq=1 Ack=173261 Win=291456 Len=0"
"413","0.000318","10.63.7.192","128.119.245.12","TCP","16438","89544","256","65536","2262  >  80 [PSH, ACK] Seq=246421 Ack=1 Win=65536 Len=16384 [TCP segment of a reassembled PDU]"
"414","0.000256","10.63.7.192","128.119.245.12","TCP","16438","105928","256","65536","2262  >  80 [PSH, ACK] Seq=262805 Ack=1 Win=65536 Len=16384 [TCP segment of a reassembled PDU]"
"415","0.000322","10.63.7.192","128.119.245.12","TCP","16438","122312","256","65536","2262  >  80 [PSH, ACK] Seq=279189 Ack=1 Win=65536 Len=16384 [TCP segment of a reassembled PDU]"
"416","0.000320","10.63.7.192","128.119.245.12","TCP","16438","138696","256","65536","2262  >  80 [PSH, ACK] Seq=295573 Ack=1 Win=65536 Len=16384 [TCP segment of a reassembled PDU]"
"606","0.059428","128.119.245.12","10.63.7.192","TCP","60","","2391","306048","80  >  2262 [ACK] Seq=1 Ack=180561 Win=306048 Len=0"
"607","0.000002","128.119.245.12","10.63.7.192","TCP","60","","2505","320640","80  >  2262 [ACK] Seq=1 Ack=187861 Win=320640 Len=0"
"608","0.000001","128.119.245.12","10.63.7.192","TCP","60","","2619","335232","80  >  2262 [ACK] Seq=1 Ack=195161 Win=335232 Len=0"
"609","0.000001","128.119.245.12","10.63.7.192","TCP","60","","2733","349824","80  >  2262 [ACK] Seq=1 Ack=202461 Win=349824 Len=0"
"610","0.000001","128.119.245.12","10.63.7.192","TCP","60","","2847","364416","80  >  2262 [ACK] Seq=1 Ack=209761 Win=364416 Len=0"
"611","0.000000","128.119.245.12","10.63.7.192","TCP","60","","2961","379008","80  >  2262 [ACK] Seq=1 Ack=217061 Win=379008 Len=0"
"612","0.000001","128.119.245.12","10.63.7.192","TCP","60","","2966","379648","80  >  2262 [ACK] Seq=1 Ack=224361 Win=379648 Len=0"
"613","0.000125","10.63.7.192","128.119.245.12","TCP","64294","151836","256","65536","2262  >  80 [PSH, ACK] Seq=311957 Ack=1 Win=65536 Len=64240 [TCP segment of a reassembled PDU]"
"614","0.000082","10.63.7.192","128.119.245.12","TCP","27794","179576","256","65536","2262  >  80 [PSH, ACK] Seq=376197 Ack=1 Win=65536 Len=27740 [TCP segment of a reassembled PDU]"
"615","0.000121","128.119.245.12","10.63.7.192","TCP","60","","2966","379648","80  >  2262 [ACK] Seq=1 Ack=231661 Win=379648 Len=0"
"616","0.000000","128.119.245.12","10.63.7.192","TCP","60","","2974","380672","80  >  2262 [ACK] Seq=1 Ack=237501 Win=380672 Len=0"
"617","0.000001","128.119.245.12","10.63.7.192","TCP","60","","2966","379648","80  >  2262 [ACK] Seq=1 Ack=238961 Win=379648 Len=0"
"618","0.000001","128.119.245.12","10.63.7.192","TCP","60","","2966","379648","80  >  2262 [ACK] Seq=1 Ack=246261 Win=379648 Len=0"
"619","0.000001","128.119.245.12","10.63.7.192","TCP","60","","2981","381568","80  >  2262 [ACK] Seq=1 Ack=246421 Win=381568 Len=0"
"620","0.000001","128.119.245.12","10.63.7.192","TCP","60","","2972","380416","80  >  2262 [ACK] Seq=1 Ack=252261 Win=380416 Len=0"
"621","0.000000","128.119.245.12","10.63.7.192","TCP","60","","2966","379648","80  >  2262 [ACK] Seq=1 Ack=259561 Win=379648 Len=0"
"622","0.000001","128.119.245.12","10.63.7.192","TCP","60","","2981","381568","80  >  2262 [ACK] Seq=1 Ack=262805 Win=381568 Len=0"
"623","0.000001","128.119.245.12","10.63.7.192","TCP","60","","2981","381568","80  >  2262 [ACK] Seq=1 Ack=265725 Win=381568 Len=0"
"624","0.000001","128.119.245.12","10.63.7.192","TCP","60","","2981","381568","80  >  2262 [ACK] Seq=1 Ack=273025 Win=381568 Len=0"
"625","0.000001","128.119.245.12","10.63.7.192","TCP","60","","2981","381568","80  >  2262 [ACK] Seq=1 Ack=279189 Win=381568 Len=0"
"626","0.000000","128.119.245.12","10.63.7.192","TCP","60","","2981","381568","80  >  2262 [ACK] Seq=1 Ack=286489 Win=381568 Len=0"
"627","0.000001","128.119.245.12","10.63.7.192","TCP","60","","2981","381568","80  >  2262 [ACK] Seq=1 Ack=293789 Win=381568 Len=0"
"628","0.000103","10.63.7.192","128.119.245.12","TCP","39146","149240","256","65536","2262  >  80 [PSH, ACK] Seq=403937 Ack=1 Win=65536 Len=39092 [TCP segment of a reassembled PDU]"
"629","0.000234","128.119.245.12","10.63.7.192","TCP","60","","2981","381568","80  >  2262 [ACK] Seq=1 Ack=295573 Win=381568 Len=0"
"630","0.000002","128.119.245.12","10.63.7.192","TCP","60","","2981","381568","80  >  2262 [ACK] Seq=1 Ack=299953 Win=381568 Len=0"
"631","0.000000","128.119.245.12","10.63.7.192","TCP","60","","3095","396160","80  >  2262 [ACK] Seq=1 Ack=307253 Win=396160 Len=0"
"632","0.000001","128.119.245.12","10.63.7.192","TCP","60","","3169","405632","80  >  2262 [ACK] Seq=1 Ack=311957 Win=405632 Len=0"
"634","0.000143","10.63.7.192","128.119.245.12","TCP","16438","147456","256","65536","2262  >  80 [PSH, ACK] Seq=443029 Ack=1 Win=65536 Len=16384 [TCP segment of a reassembled PDU]"
"635","0.000245","10.63.7.192","128.119.245.12","TCP","16438","163840","256","65536","2262  >  80 [PSH, ACK] Seq=459413 Ack=1 Win=65536 Len=16384 [TCP segment of a reassembled PDU]"
"636","0.000322","10.63.7.192","128.119.245.12","TCP","16438","180224","256","65536","2262  >  80 [PSH, ACK] Seq=475797 Ack=1 Win=65536 Len=16384 [TCP segment of a reassembled PDU]"
"637","0.000321","10.63.7.192","128.119.245.12","TCP","16438","196608","256","65536","2262  >  80 [PSH, ACK] Seq=492181 Ack=1 Win=65536 Len=16384 [TCP segment of a reassembled PDU]"
"638","0.000321","10.63.7.192","128.119.245.12","TCP","16438","212992","256","65536","2262  >  80 [PSH, ACK] Seq=508565 Ack=1 Win=65536 Len=16384 [TCP segment of a reassembled PDU]"
"681","0.014038","10.63.7.192","128.119.245.12","TCP","16438","229376","256","65536","2262  >  80 [PSH, ACK] Seq=524949 Ack=1 Win=65536 Len=16384 [TCP segment of a reassembled PDU]"
"682","0.000295","10.63.7.192","128.119.245.12","TCP","16438","245760","256","65536","2262  >  80 [PSH, ACK] Seq=541333 Ack=1 Win=65536 Len=16384 [TCP segment of a reassembled PDU]"
"683","0.000273","10.63.7.192","128.119.245.12","TCP","10274","255980","256","65536","2262  >  80 [ACK] Seq=557717 Ack=1 Win=65536 Len=10220 [TCP segment of a reassembled PDU]"
"684","0.026806","128.119.245.12","10.63.7.192","TCP","60","","3283","420224","80  >  2262 [ACK] Seq=1 Ack=319257 Win=420224 Len=0"
"685","0.000002","128.119.245.12","10.63.7.192","TCP","60","","3397","434816","80  >  2262 [ACK] Seq=1 Ack=326557 Win=434816 Len=0"
"686","0.000001","128.119.245.12","10.63.7.192","TCP","60","","3511","449408","80  >  2262 [ACK] Seq=1 Ack=333857 Win=449408 Len=0"
"687","0.000000","128.119.245.12","10.63.7.192","TCP","60","","3625","464000","80  >  2262 [ACK] Seq=1 Ack=341157 Win=464000 Len=0"
"688","0.000001","128.119.245.12","10.63.7.192","TCP","60","","3739","478592","80  >  2262 [ACK] Seq=1 Ack=348457 Win=478592 Len=0"
"689","0.000001","128.119.245.12","10.63.7.192","TCP","60","","3853","493184","80  >  2262 [ACK] Seq=1 Ack=355757 Win=493184 Len=0"
"690","0.000001","128.119.245.12","10.63.7.192","TCP","60","","3967","507776","80  >  2262 [ACK] Seq=1 Ack=363057 Win=507776 Len=0"
"691","0.000001","128.119.245.12","10.63.7.192","TCP","60","","4081","522368","80  >  2262 [ACK] Seq=1 Ack=370357 Win=522368 Len=0"
"692","0.000000","128.119.245.12","10.63.7.192","TCP","60","","4173","534144","80  >  2262 [ACK] Seq=1 Ack=376197 Win=534144 Len=0"
"693","0.000001","128.119.245.12","10.63.7.192","TCP","60","","4195","536960","80  >  2262 [ACK] Seq=1 Ack=377657 Win=536960 Len=0"
"694","0.000138","10.63.7.192","128.119.245.12","HTTP","31511","221737","256","65536","POST /wireshark-labs/lab3-1-reply.htm HTTP/1.1  (text/plain)"
"695","0.000172","128.119.245.12","10.63.7.192","TCP","60","","4309","551552","80  >  2262 [ACK] Seq=1 Ack=384957 Win=551552 Len=0"
"696","0.000002","128.119.245.12","10.63.7.192","TCP","60","","4423","566144","80  >  2262 [ACK] Seq=1 Ack=392257 Win=566144 Len=0"
"697","0.000001","128.119.245.12","10.63.7.192","TCP","60","","4538","580864","80  >  2262 [ACK] Seq=1 Ack=399557 Win=580864 Len=0"
"698","0.000001","128.119.245.12","10.63.7.192","TCP","60","","4606","589568","80  >  2262 [ACK] Seq=1 Ack=403937 Win=589568 Len=0"
"699","0.000000","128.119.245.12","10.63.7.192","TCP","60","","4629","592512","80  >  2262 [ACK] Seq=1 Ack=405397 Win=592512 Len=0"
"700","0.000001","128.119.245.12","10.63.7.192","TCP","66","","4652","595456","[TCP Window Update] 80  >  2262 [ACK] Seq=1 Ack=405397 Win=595456 Len=0 SLE=466713 SRE=468173"
"701","0.000001","128.119.245.12","10.63.7.192","TCP","66","","4766","610048","80  >  2262 [ACK] Seq=1 Ack=412697 Win=610048 Len=0 SLE=466713 SRE=468173"
"702","0.000280","128.119.245.12","10.63.7.192","TCP","66","","4880","624640","80  >  2262 [ACK] Seq=1 Ack=419997 Win=624640 Len=0 SLE=466713 SRE=468173"
"703","0.000002","128.119.245.12","10.63.7.192","TCP","66","","4994","639232","80  >  2262 [ACK] Seq=1 Ack=427297 Win=639232 Len=0 SLE=466713 SRE=468173"
"704","0.000000","128.119.245.12","10.63.7.192","TCP","66","","5108","653824","80  >  2262 [ACK] Seq=1 Ack=434597 Win=653824 Len=0 SLE=466713 SRE=468173"
"705","0.000001","128.119.245.12","10.63.7.192","TCP","66","","5222","668416","80  >  2262 [ACK] Seq=1 Ack=441897 Win=668416 Len=0 SLE=466713 SRE=468173"
"706","0.000369","128.119.245.12","10.63.7.192","TCP","66","","5245","671360","80  >  2262 [ACK] Seq=1 Ack=443029 Win=671360 Len=0 SLE=466713 SRE=468173"
"707","0.000001","128.119.245.12","10.63.7.192","TCP","66","","5336","683008","80  >  2262 [ACK] Seq=1 Ack=448869 Win=683008 Len=0 SLE=466713 SRE=468173"
"708","0.000001","128.119.245.12","10.63.7.192","TCP","66","","5450","697600","80  >  2262 [ACK] Seq=1 Ack=456169 Win=697600 Len=0 SLE=466713 SRE=468173"
"709","0.000001","128.119.245.12","10.63.7.192","TCP","66","","5501","704128","80  >  2262 [ACK] Seq=1 Ack=459413 Win=704128 Len=0 SLE=466713 SRE=468173"
"710","0.000001","128.119.245.12","10.63.7.192","TCP","66","","5546","709888","80  >  2262 [ACK] Seq=1 Ack=462333 Win=709888 Len=0 SLE=466713 SRE=468173"
"711","0.000001","128.119.245.12","10.63.7.192","TCP","66","","5592","715776","80  >  2262 [ACK] Seq=1 Ack=465253 Win=715776 Len=0 SLE=466713 SRE=468173"
"712","0.000001","128.119.245.12","10.63.7.192","TCP","66","","5615","718720","[TCP Window Update] 80  >  2262 [ACK] Seq=1 Ack=465253 Win=718720 Len=0 SLE=466713 SRE=469633"
"713","0.000000","128.119.245.12","10.63.7.192","TCP","60","","5638","721664","80  >  2262 [ACK] Seq=1 Ack=469633 Win=721664 Len=0"
"714","0.000001","128.119.245.12","10.63.7.192","TCP","60","","5660","724480","80  >  2262 [ACK] Seq=1 Ack=471093 Win=724480 Len=0"
"715","0.000001","128.119.245.12","10.63.7.192","TCP","60","","5734","733952","80  >  2262 [ACK] Seq=1 Ack=475797 Win=733952 Len=0"
"716","0.000001","128.119.245.12","10.63.7.192","TCP","60","","5848","748544","80  >  2262 [ACK] Seq=1 Ack=483097 Win=748544 Len=0"
"717","0.000308","128.119.245.12","10.63.7.192","TCP","60","","5871","751488","80  >  2262 [ACK] Seq=1 Ack=484557 Win=751488 Len=0"
"718","0.000001","128.119.245.12","10.63.7.192","TCP","60","","5894","754432","80  >  2262 [ACK] Seq=1 Ack=486017 Win=754432 Len=0"
"719","0.000001","128.119.245.12","10.63.7.192","TCP","60","","5916","757248","80  >  2262 [ACK] Seq=1 Ack=487477 Win=757248 Len=0"
"720","0.000344","128.119.245.12","10.63.7.192","TCP","60","","5939","760192","80  >  2262 [ACK] Seq=1 Ack=488937 Win=760192 Len=0"
"721","0.000002","128.119.245.12","10.63.7.192","TCP","60","","5962","763136","80  >  2262 [ACK] Seq=1 Ack=490397 Win=763136 Len=0"
"722","0.000329","128.119.245.12","10.63.7.192","TCP","60","","5990","766720","80  >  2262 [ACK] Seq=1 Ack=492181 Win=766720 Len=0"
"723","0.000001","128.119.245.12","10.63.7.192","TCP","60","","6013","769664","80  >  2262 [ACK] Seq=1 Ack=493641 Win=769664 Len=0"
"724","0.000001","128.119.245.12","10.63.7.192","TCP","60","","6036","772608","80  >  2262 [ACK] Seq=1 Ack=495101 Win=772608 Len=0"
"725","0.000386","128.119.245.12","10.63.7.192","TCP","60","","6058","775424","80  >  2262 [ACK] Seq=1 Ack=496561 Win=775424 Len=0"
"726","0.000002","128.119.245.12","10.63.7.192","TCP","60","","6081","778368","80  >  2262 [ACK] Seq=1 Ack=498021 Win=778368 Len=0"
"727","0.000000","128.119.245.12","10.63.7.192","TCP","60","","6104","781312","80  >  2262 [ACK] Seq=1 Ack=499481 Win=781312 Len=0"
"728","0.000330","128.119.245.12","10.63.7.192","TCP","60","","6127","784256","80  >  2262 [ACK] Seq=1 Ack=500941 Win=784256 Len=0"
"729","0.000001","128.119.245.12","10.63.7.192","TCP","60","","6150","787200","80  >  2262 [ACK] Seq=1 Ack=502401 Win=787200 Len=0"
"730","0.000001","128.119.245.12","10.63.7.192","TCP","60","","6172","790016","80  >  2262 [ACK] Seq=1 Ack=503861 Win=790016 Len=0"
"731","0.000564","128.119.245.12","10.63.7.192","TCP","60","","6195","792960","80  >  2262 [ACK] Seq=1 Ack=505321 Win=792960 Len=0"
"732","0.000002","128.119.245.12","10.63.7.192","TCP","60","","6218","795904","80  >  2262 [ACK] Seq=1 Ack=506781 Win=795904 Len=0"
"733","0.000001","128.119.245.12","10.63.7.192","TCP","60","","6246","799488","80  >  2262 [ACK] Seq=1 Ack=508565 Win=799488 Len=0"
"734","0.000001","128.119.245.12","10.63.7.192","TCP","60","","6269","802432","80  >  2262 [ACK] Seq=1 Ack=510025 Win=802432 Len=0"
"735","0.000289","128.119.245.12","10.63.7.192","TCP","60","","6292","805376","80  >  2262 [ACK] Seq=1 Ack=511485 Win=805376 Len=0"
"736","0.000001","128.119.245.12","10.63.7.192","TCP","60","","6314","808192","80  >  2262 [ACK] Seq=1 Ack=512945 Win=808192 Len=0"
"737","0.000001","128.119.245.12","10.63.7.192","TCP","60","","6337","811136","80  >  2262 [ACK] Seq=1 Ack=514405 Win=811136 Len=0"
"738","0.000463","128.119.245.12","10.63.7.192","TCP","60","","6360","814080","80  >  2262 [ACK] Seq=1 Ack=515865 Win=814080 Len=0"
"739","0.000002","128.119.245.12","10.63.7.192","TCP","60","","6383","817024","80  >  2262 [ACK] Seq=1 Ack=517325 Win=817024 Len=0"
"740","0.000000","128.119.245.12","10.63.7.192","TCP","60","","6396","818688","80  >  2262 [ACK] Seq=1 Ack=518785 Win=818688 Len=0"
"741","0.000001","128.119.245.12","10.63.7.192","TCP","60","","6396","818688","80  >  2262 [ACK] Seq=1 Ack=520245 Win=818688 Len=0"
"742","0.000501","128.119.245.12","10.63.7.192","TCP","60","","6396","818688","80  >  2262 [ACK] Seq=1 Ack=521705 Win=818688 Len=0"
"743","0.000001","128.119.245.12","10.63.7.192","TCP","60","","6396","818688","80  >  2262 [ACK] Seq=1 Ack=523165 Win=818688 Len=0"
"744","0.000001","128.119.245.12","10.63.7.192","TCP","60","","6396","818688","80  >  2262 [ACK] Seq=1 Ack=524949 Win=818688 Len=0"
"745","0.000533","128.119.245.12","10.63.7.192","TCP","60","","6396","818688","80  >  2262 [ACK] Seq=1 Ack=526409 Win=818688 Len=0"
"746","0.000002","128.119.245.12","10.63.7.192","TCP","60","","6396","818688","80  >  2262 [ACK] Seq=1 Ack=527869 Win=818688 Len=0"
"747","0.000001","128.119.245.12","10.63.7.192","TCP","60","","6396","818688","80  >  2262 [ACK] Seq=1 Ack=529329 Win=818688 Len=0"
"748","0.000001","128.119.245.12","10.63.7.192","TCP","60","","6396","818688","80  >  2262 [ACK] Seq=1 Ack=530789 Win=818688 Len=0"
"749","0.000325","128.119.245.12","10.63.7.192","TCP","60","","6396","818688","80  >  2262 [ACK] Seq=1 Ack=532249 Win=818688 Len=0"
"750","0.000002","128.119.245.12","10.63.7.192","TCP","60","","6396","818688","80  >  2262 [ACK] Seq=1 Ack=533709 Win=818688 Len=0"
"751","0.000001","128.119.245.12","10.63.7.192","TCP","60","","6396","818688","80  >  2262 [ACK] Seq=1 Ack=535169 Win=818688 Len=0"
"752","0.000766","128.119.245.12","10.63.7.192","TCP","60","","6396","818688","80  >  2262 [ACK] Seq=1 Ack=536629 Win=818688 Len=0"
"753","0.000002","128.119.245.12","10.63.7.192","TCP","60","","6396","818688","80  >  2262 [ACK] Seq=1 Ack=538089 Win=818688 Len=0"
"754","0.000001","128.119.245.12","10.63.7.192","TCP","60","","6396","818688","80  >  2262 [ACK] Seq=1 Ack=539549 Win=818688 Len=0"
"755","0.000000","128.119.245.12","10.63.7.192","TCP","60","","6396","818688","80  >  2262 [ACK] Seq=1 Ack=541333 Win=818688 Len=0"
"756","0.000001","128.119.245.12","10.63.7.192","TCP","60","","6396","818688","80  >  2262 [ACK] Seq=1 Ack=542793 Win=818688 Len=0"
"757","0.000422","128.119.245.12","10.63.7.192","TCP","60","","6396","818688","80  >  2262 [ACK] Seq=1 Ack=545713 Win=818688 Len=0"
"758","0.000342","128.119.245.12","10.63.7.192","TCP","60","","6396","818688","80  >  2262 [ACK] Seq=1 Ack=548633 Win=818688 Len=0"
"759","0.000002","128.119.245.12","10.63.7.192","TCP","60","","6396","818688","80  >  2262 [ACK] Seq=1 Ack=551553 Win=818688 Len=0"
"760","0.000691","128.119.245.12","10.63.7.192","TCP","60","","6396","818688","80  >  2262 [ACK] Seq=1 Ack=554473 Win=818688 Len=0"
"761","0.000002","128.119.245.12","10.63.7.192","TCP","60","","6396","818688","80  >  2262 [ACK] Seq=1 Ack=557717 Win=818688 Len=0"
"762","0.000001","128.119.245.12","10.63.7.192","TCP","60","","6396","818688","80  >  2262 [ACK] Seq=1 Ack=560637 Win=818688 Len=0"
"763","0.000720","128.119.245.12","10.63.7.192","TCP","60","","6396","818688","80  >  2262 [ACK] Seq=1 Ack=563557 Win=818688 Len=0"
"764","0.000001","128.119.245.12","10.63.7.192","TCP","60","","6396","818688","80  >  2262 [ACK] Seq=1 Ack=566477 Win=818688 Len=0"
"765","0.022281","128.119.245.12","10.63.7.192","TCP","60","","6396","818688","80  >  2262 [ACK] Seq=1 Ack=569397 Win=818688 Len=0"
"766","0.000002","128.119.245.12","10.63.7.192","TCP","60","","6419","821632","80  >  2262 [ACK] Seq=1 Ack=570857 Win=821632 Len=0"
"767","0.000001","128.119.245.12","10.63.7.192","TCP","60","","6442","824576","80  >  2262 [ACK] Seq=1 Ack=572317 Win=824576 Len=0"
"768","0.000001","128.119.245.12","10.63.7.192","TCP","60","","6465","827520","80  >  2262 [ACK] Seq=1 Ack=573777 Win=827520 Len=0"
"769","0.000000","128.119.245.12","10.63.7.192","TCP","60","","6488","830464","80  >  2262 [ACK] Seq=1 Ack=575237 Win=830464 Len=0"
"770","0.000001","128.119.245.12","10.63.7.192","TCP","60","","6510","833280","80  >  2262 [ACK] Seq=1 Ack=576697 Win=833280 Len=0"
"771","0.000715","128.119.245.12","10.63.7.192","TCP","60","","6533","836224","80  >  2262 [ACK] Seq=1 Ack=578157 Win=836224 Len=0"
"772","0.000002","128.119.245.12","10.63.7.192","TCP","60","","6556","839168","80  >  2262 [ACK] Seq=1 Ack=579617 Win=839168 Len=0"
"773","0.000001","128.119.245.12","10.63.7.192","TCP","60","","6579","842112","80  >  2262 [ACK] Seq=1 Ack=581077 Win=842112 Len=0"
"774","0.000001","128.119.245.12","10.63.7.192","TCP","60","","6589","843392","80  >  2262 [ACK] Seq=1 Ack=582537 Win=843392 Len=0"
"775","0.000001","128.119.245.12","10.63.7.192","TCP","60","","6589","843392","80  >  2262 [ACK] Seq=1 Ack=585457 Win=843392 Len=0"
"776","0.000832","128.119.245.12","10.63.7.192","TCP","60","","6589","843392","80  >  2262 [ACK] Seq=1 Ack=588377 Win=843392 Len=0"
"777","0.000002","128.119.245.12","10.63.7.192","TCP","60","","6589","843392","80  >  2262 [ACK] Seq=1 Ack=591297 Win=843392 Len=0"
"778","0.000001","128.119.245.12","10.63.7.192","TCP","60","","6589","843392","80  >  2262 [ACK] Seq=1 Ack=594217 Win=843392 Len=0"
"779","0.000774","128.119.245.12","10.63.7.192","TCP","60","","6589","843392","80  >  2262 [ACK] Seq=1 Ack=597137 Win=843392 Len=0"
"780","0.000002","128.119.245.12","10.63.7.192","TCP","60","","6589","843392","80  >  2262 [ACK] Seq=1 Ack=599394 Win=843392 Len=0"
"781","0.000001","128.119.245.12","10.63.7.192","HTTP","831","777","6589","843392","HTTP/1.1 200 OK  (text/html)"
"783","0.198334","10.63.7.192","128.119.245.12","TCP","54","","253","64768","2262  >  80 [ACK] Seq=599394 Ack=778 Win=64768 Len=0"
